{
  "schema_version": "1.0",
  "app_image": "wb-telegram:wb04",
  "profile": "t1-api-v1",
  "tools": [
    {
      "name": "get_chat",
      "schema_version": "1.0",
      "description": "Read a chat by its exact ID; otherwise not_found.",
      "arguments_schema": {
        "type": "object",
        "additionalProperties": false,
        "required": [
          "chat_id"
        ],
        "properties": {
          "chat_id": {
            "type": "string",
            "minLength": 1,
            "maxLength": 128
          }
        }
      },
      "result_schema": {
        "type": "object",
        "additionalProperties": false,
        "required": [
          "id",
          "display_name"
        ],
        "properties": {
          "id": {
            "type": "string",
            "minLength": 1,
            "maxLength": 128
          },
          "display_name": {
            "type": "string",
            "maxLength": 4096
          }
        }
      },
      "effect": "read",
      "limits": {},
      "errors": [
        "not_found",
        "invalid_arguments",
        "forbidden",
        "limit_exceeded",
        "transport_unknown"
      ],
      "idempotency": "read only",
      "effect_observation": "list_messages exposes message IDs, chat IDs and exact text; server response does not prove client receipt."
    },
    {
      "name": "list_messages",
      "schema_version": "1.0",
      "description": "Read all messages for the exact chat ID. Over 100 messages yields limit_exceeded; never truncate.",
      "arguments_schema": {
        "type": "object",
        "additionalProperties": false,
        "required": [
          "chat_id"
        ],
        "properties": {
          "chat_id": {
            "type": "string",
            "minLength": 1,
            "maxLength": 128
          }
        }
      },
      "result_schema": {
        "type": "array",
        "items": {
          "type": "object",
          "additionalProperties": false,
          "required": [
            "id",
            "chat_id",
            "direction",
            "text"
          ],
          "properties": {
            "id": {
              "type": "string",
              "minLength": 1,
              "maxLength": 128
            },
            "chat_id": {
              "type": "string",
              "minLength": 1,
              "maxLength": 128
            },
            "direction": {
              "enum": [
                "incoming",
                "outgoing"
              ]
            },
            "text": {
              "type": "string",
              "maxLength": 4096
            }
          }
        }
      },
      "effect": "read",
      "limits": {
        "max_messages": 100
      },
      "errors": [
        "not_found",
        "invalid_arguments",
        "forbidden",
        "limit_exceeded",
        "transport_unknown"
      ],
      "idempotency": "read only",
      "effect_observation": "list_messages exposes message IDs, chat IDs and exact text; server response does not prove client receipt."
    },
    {
      "name": "send_message",
      "schema_version": "1.0",
      "description": "Append the exact text to the exact chat ID. Unknown chat: not_found and no write. Every accepted write creates a new message. Never retry blindly after a lost response; observe the effect or report unknown.",
      "arguments_schema": {
        "type": "object",
        "additionalProperties": false,
        "required": [
          "chat_id",
          "text"
        ],
        "properties": {
          "chat_id": {
            "type": "string",
            "minLength": 1,
            "maxLength": 128
          },
          "text": {
            "type": "string",
            "maxLength": 4096
          }
        }
      },
      "result_schema": {
        "type": "object",
        "additionalProperties": false,
        "required": [
          "id",
          "chat_id",
          "direction",
          "text"
        ],
        "properties": {
          "id": {
            "type": "string",
            "minLength": 1,
            "maxLength": 128
          },
          "chat_id": {
            "type": "string",
            "minLength": 1,
            "maxLength": 128
          },
          "direction": {
            "enum": [
              "incoming",
              "outgoing"
            ]
          },
          "text": {
            "type": "string",
            "maxLength": 4096
          }
        }
      },
      "effect": "write",
      "limits": {},
      "errors": [
        "not_found",
        "invalid_arguments",
        "forbidden",
        "limit_exceeded",
        "transport_unknown"
      ],
      "idempotency": "none",
      "effect_observation": "list_messages exposes message IDs, chat IDs and exact text; server response does not prove client receipt."
    }
  ]
}
